{
  "schemaVersion": 1,
  "name": "EverythingStar FOSS",
  "description": "Ultrastar songs converted with separated stems.",
  "songs": [
    {
      "id": "jonathan-coulton-code-monkey",
      "song": "Jonathan Coulton - Code Monkey/song.json",
      "title": "Code Monkey",
      "artist": {
        "id": "jonathan-coulton",
        "name": "Jonathan Coulton"
      },
      "art": "Jonathan Coulton - Code Monkey/album.jpg",
      "durationMs": 189973,
      "previewStartMs": 23000,
      "offer": {
        "instruments": [
          {
            "role": "guitar",
            "difficulties": [
              "easy",
              "normal",
              "hard",
              "expert"
            ]
          },
          {
            "role": "bass",
            "difficulties": [
              "easy",
              "normal",
              "hard",
              "expert"
            ]
          },
          {
            "role": "drums",
            "difficulties": [
              "easy",
              "normal",
              "hard",
              "expert"
            ]
          }
        ],
        "voice": {
          "chartType": "vocals",
          "parts": 1
        }
      }
    },
    {
      "id": "fairy-bot-orchestra-heaven-can-t-wait",
      "song": "Fairy Bot Orchestra - Heaven can't wait/song.json",
      "title": "Heaven can't wait",
      "artist": {
        "id": "fairy-bot-orchestra",
        "name": "Fairy Bot Orchestra"
      },
      "art": "Fairy Bot Orchestra - Heaven can't wait/album.jpg",
      "durationMs": 188953,
      "previewStartMs": 56686,
      "offer": {
        "instruments": [],
        "voice": {
          "chartType": "vocals",
          "parts": 1
        }
      }
    },
    {
      "id": "jonathan-coulton-a-talk-with-george",
      "song": "Jonathan Coulton - A Talk with George/song.json",
      "title": "A Talk with George",
      "artist": {
        "id": "jonathan-coulton",
        "name": "Jonathan Coulton"
      },
      "art": "Jonathan Coulton - A Talk with George/album.png",
      "durationMs": 184189,
      "previewStartMs": 55257,
      "offer": {
        "instruments": [],
        "voice": {
          "chartType": "vocals",
          "parts": 1
        }
      }
    },
    {
      "id": "jonathan-coulton-better",
      "song": "Jonathan Coulton - Better/song.json",
      "title": "Better",
      "artist": {
        "id": "jonathan-coulton",
        "name": "Jonathan Coulton"
      },
      "art": "Jonathan Coulton - Better/album.jpg",
      "durationMs": 194612,
      "previewStartMs": 58384,
      "offer": {
        "instruments": [],
        "voice": {
          "chartType": "vocals",
          "parts": 1
        }
      }
    },
    {
      "id": "jonathan-coulton-big-bad-world-one",
      "song": "Jonathan Coulton - Big Bad World One/song.json",
      "title": "Big Bad World One",
      "artist": {
        "id": "jonathan-coulton",
        "name": "Jonathan Coulton"
      },
      "art": "Jonathan Coulton - Big Bad World One/album.png",
      "durationMs": 170475,
      "previewStartMs": 51143,
      "offer": {
        "instruments": [],
        "voice": {
          "chartType": "vocals",
          "parts": 1
        }
      }
    },
    {
      "id": "jonathan-coulton-chiron-beta-prime",
      "song": "Jonathan Coulton - Chiron Beta Prime/song.json",
      "title": "Chiron Beta Prime",
      "artist": {
        "id": "jonathan-coulton",
        "name": "Jonathan Coulton"
      },
      "art": "Jonathan Coulton - Chiron Beta Prime/album.png",
      "durationMs": 170684,
      "previewStartMs": 51205,
      "offer": {
        "instruments": [],
        "voice": {
          "chartType": "vocals",
          "parts": 1
        }
      }
    },
    {
      "id": "jonathan-coulton-creepy-doll",
      "song": "Jonathan Coulton - Creepy Doll/song.json",
      "title": "Creepy Doll",
      "artist": {
        "id": "jonathan-coulton",
        "name": "Jonathan Coulton"
      },
      "art": "Jonathan Coulton - Creepy Doll/album.png",
      "durationMs": 240144,
      "previewStartMs": 72043,
      "offer": {
        "instruments": [],
        "voice": {
          "chartType": "vocals",
          "parts": 1
        }
      }
    },
    {
      "id": "jonathan-coulton-dance-soterios-johnson-dance",
      "song": "Jonathan Coulton - Dance, Soterios Johnson, Dance/song.json",
      "title": "Dance, Soterios Johnson, Dance",
      "artist": {
        "id": "jonathan-coulton",
        "name": "Jonathan Coulton"
      },
      "art": "Jonathan Coulton - Dance, Soterios Johnson, Dance/album.png",
      "durationMs": 231367,
      "previewStartMs": 69410,
      "offer": {
        "instruments": [],
        "voice": {
          "chartType": "vocals",
          "parts": 1
        }
      }
    },
    {
      "id": "jonathan-coulton-first-of-may",
      "song": "Jonathan Coulton - First of May/song.json",
      "title": "First of May",
      "artist": {
        "id": "jonathan-coulton",
        "name": "Jonathan Coulton"
      },
      "art": "Jonathan Coulton - First of May/album.png",
      "durationMs": 250488,
      "previewStartMs": 75146,
      "offer": {
        "instruments": [],
        "voice": {
          "chartType": "vocals",
          "parts": 1
        }
      }
    },
    {
      "id": "jonathan-coulton-flickr",
      "song": "Jonathan Coulton - Flickr/song.json",
      "title": "Flickr",
      "artist": {
        "id": "jonathan-coulton",
        "name": "Jonathan Coulton"
      },
      "art": "Jonathan Coulton - Flickr/album.png",
      "durationMs": 167967,
      "previewStartMs": 50390,
      "offer": {
        "instruments": [],
        "voice": {
          "chartType": "vocals",
          "parts": 1
        }
      }
    },
    {
      "id": "jonathan-coulton-furry-old-lobster",
      "song": "Jonathan Coulton - Furry Old Lobster/song.json",
      "title": "Furry Old Lobster",
      "artist": {
        "id": "jonathan-coulton",
        "name": "Jonathan Coulton"
      },
      "art": "Jonathan Coulton - Furry Old Lobster/album.png",
      "durationMs": 122122,
      "previewStartMs": 36637,
      "offer": {
        "instruments": [],
        "voice": {
          "chartType": "vocals",
          "parts": 1
        }
      }
    },
    {
      "id": "jonathan-coulton-i-crush-everything",
      "song": "Jonathan Coulton - I Crush Everything/song.json",
      "title": "I Crush Everything",
      "artist": {
        "id": "jonathan-coulton",
        "name": "Jonathan Coulton"
      },
      "art": "Jonathan Coulton - I Crush Everything/album.png",
      "durationMs": 282880,
      "previewStartMs": 84864,
      "offer": {
        "instruments": [],
        "voice": {
          "chartType": "vocals",
          "parts": 1
        }
      }
    },
    {
      "id": "jonathan-coulton-i-feel-fantastic",
      "song": "Jonathan Coulton - I Feel Fantastic/song.json",
      "title": "I Feel Fantastic",
      "artist": {
        "id": "jonathan-coulton",
        "name": "Jonathan Coulton"
      },
      "art": "Jonathan Coulton - I Feel Fantastic/album.jpg",
      "durationMs": 183066,
      "previewStartMs": 54920,
      "offer": {
        "instruments": [],
        "voice": {
          "chartType": "vocals",
          "parts": 1
        }
      }
    },
    {
      "id": "jonathan-coulton-i-m-your-moon",
      "song": "Jonathan Coulton - I'm Your Moon/song.json",
      "title": "I'm Your Moon",
      "artist": {
        "id": "jonathan-coulton",
        "name": "Jonathan Coulton"
      },
      "art": "Jonathan Coulton - I'm Your Moon/album.png",
      "durationMs": 192653,
      "previewStartMs": 57796,
      "offer": {
        "instruments": [],
        "voice": {
          "chartType": "vocals",
          "parts": 1
        }
      }
    },
    {
      "id": "jonathan-coulton-ikea",
      "song": "Jonathan Coulton - Ikea/song.json",
      "title": "Ikea",
      "artist": {
        "id": "jonathan-coulton",
        "name": "Jonathan Coulton"
      },
      "art": "Jonathan Coulton - Ikea/album.png",
      "durationMs": 183589,
      "previewStartMs": 55077,
      "offer": {
        "instruments": [],
        "voice": {
          "chartType": "vocals",
          "parts": 1
        }
      }
    },
    {
      "id": "jonathan-coulton-monkey-shines",
      "song": "Jonathan Coulton - Monkey Shines/song.json",
      "title": "Monkey Shines",
      "artist": {
        "id": "jonathan-coulton",
        "name": "Jonathan Coulton"
      },
      "art": "Jonathan Coulton - Monkey Shines/album.jpg",
      "durationMs": 51069,
      "previewStartMs": 20000,
      "offer": {
        "instruments": [],
        "voice": {
          "chartType": "vocals",
          "parts": 1
        }
      }
    },
    {
      "id": "jonathan-coulton-mr-fancy-pants",
      "song": "Jonathan Coulton - Mr. Fancy Pants/song.json",
      "title": "Mr. Fancy Pants",
      "artist": {
        "id": "jonathan-coulton",
        "name": "Jonathan Coulton"
      },
      "art": "Jonathan Coulton - Mr. Fancy Pants/album.png",
      "durationMs": 79517,
      "previewStartMs": 23855,
      "offer": {
        "instruments": [],
        "voice": {
          "chartType": "vocals",
          "parts": 1
        }
      }
    },
    {
      "id": "jonathan-coulton-my-beige-bear",
      "song": "Jonathan Coulton - My Beige Bear/song.json",
      "title": "My Beige Bear",
      "artist": {
        "id": "jonathan-coulton",
        "name": "Jonathan Coulton"
      },
      "art": "Jonathan Coulton - My Beige Bear/album.jpg",
      "durationMs": 197773,
      "previewStartMs": 59332,
      "offer": {
        "instruments": [],
        "voice": {
          "chartType": "vocals",
          "parts": 1
        }
      }
    },
    {
      "id": "jonathan-coulton-not-about-you",
      "song": "Jonathan Coulton - Not About You/song.json",
      "title": "Not About You",
      "artist": {
        "id": "jonathan-coulton",